{
  "signoff_id": "SIGNOFF-GREEN-RUN-20260521-202417-001",
  "created_at": "2026-05-21T20:56:01.161Z",
  "source_run_id": "GREEN-RUN-20260521-202417",
  "dry_run_id": "PROMO-DRY-RUN-GREEN-RUN-20260521-202417-001",
  "package_id": "DRAFT-CAND-PKG-GREEN-RUN-20260521-202417-001",
  "intake_id": "INTAKE-GREEN-RUN-20260521-202417-001",
  "decision_id": "DECISION-GREEN-RUN-20260521-202417-001",
  "approval_id": "APPROVAL-GREEN-RUN-20260521-202417-001",
  "suggested_public_record_id": {
    "suggested_id": "INC-0014-SUGGESTED",
    "id_status": "suggestion_only",
    "creates_public_record": false
  },
  "signoff_status": "private_review_blocked",
  "reviewer_mode": "local_human_review_gate",
  "legal_review_status": "pending",
  "source_quotation_review_status": "pending",
  "public_narrative_review_status": "pending",
  "publication_risk_review_status": "pending",
  "control_tower_publication_approval_status": "pending",
  "unresolved_blockers": [
    "human legal/governance review required",
    "source quotation review required",
    "no public-safe narrative approved",
    "no promotion packet created",
    "no preview generated",
    "no Control Tower public publish approval"
  ],
  "resolved_checklist_items": [],
  "signoff_notes": "T068 private promotion signoff initialized from T067 dry-run. All review dimensions pending. Not publication approval.",
  "next_allowed_step": "complete_private_review_checklist_before_T069",
  "public_publish_allowed": false,
  "real_promotion_packet_allowed": false,
  "public_preview_allowed": false,
  "public_record_creation_allowed": false,
  "remote_write_allowed": false,
  "raw_text_storage_allowed": false,
  "html_storage_allowed": false,
  "safety_flags": {
    "no_raw_html": true,
    "no_long_third_party_text": true,
    "no_secrets_exposed": true,
    "no_unauthorized_remote_writes": true,
    "no_public_site_leak": true,
    "no_inc_0014_created": true,
    "no_real_promotion_packet": true,
    "no_public_preview": true,
    "not_publication_approval": true
  }
}
